{
    "decision": {
        "goal": "skill",
        "targetSkill": "Learn Chart.js",
        "current_proficiency_level": "beginner",
        "daily_time_commitable": "30",
        "preferred_learning_style": "practice",
        "probable_challenges": "motivation",
        "reaction_to_failure": "expectation",
        "preferred_coaching_style": "gentle"
    },
    "ai_response": "# Skill Acquisition Roadmap: Chart.js Mastery\n\n### **Project Overview**\nThis roadmap is designed to transition a beginner into a proficient user of **Chart.js**\u2014a popular tool used by developers to create beautiful, interactive charts on websites. The plan is built for high consistency with low time commitment, focusing on active practice rather than just reading.\n\n---\n\n### **Context: The Learner Profile**\n*   **Goal:** Reach functional proficiency in Chart.js.\n*   **Schedule:** 30 minutes per day (3.5 hours per week).\n*   **Learning Style:** Hands-on practice (Learning by doing).\n*   **Coaching Tone:** Gentle and supportive; technical errors are treated as natural steps in the learning process.\n\n---\n\n### **1. Core Learning Modules**\nTo master Chart.js, the focus will be split between understanding the \"how\" (logic) and the \"look\" (visuals).\n\n#### **Core Technical Skills**\n*   **Data Schema Mapping:** You will learn how to organize raw information into specific structures (called \"datasets\" and \"labels\") so the chart knows exactly what numbers to display and where.\n*   **Configuration Logic:** You will practice navigating the \"Options\" settings. This is where you define the \"rules\" for your chart, such as how the scales look, what happens when you hover over a bar, or how tooltips (small info boxes) appear.\n*   **Rendering Lifecycle:** You will master the life of a chart: how to initialize (start) it, how to use the `.update()` command to change data without refreshing the page, and how to `.destroy()` a chart to clear up memory.\n*   **Chart Typology:** You will gain experience implementing different types of visuals, including Bar charts, Line graphs, Pie charts, and Radar charts.\n\n#### **Supporting Skills**\n*   **Canvas Management:** Learning how to use the HTML `<canvas>` element (the area on a webpage where graphics are drawn) to ensure charts look good on both mobile phones and desktop screens.\n*   **JavaScript Array Methods:** Using logic tools like `.map()` and `.filter()` to quickly clean and prepare your data before it is sent to the chart.\n*   **Aesthetics:** Applying colors (using RGBA and gradients) and styling hover effects to make the charts visually engaging.\n\n---\n\n### **2. Weekly Practice Strategy**\nThe week is broken down into small, manageable \"Micro-Sprints\" to maintain motivation.\n\n*   **Days 1\u20133: Component Isolation**\n    *   Focus on one specific thing, such as styling the lines on a graph, until it works perfectly in a simple setup.\n*   **Days 4\u20135: Variation Drills**\n    *   Take one set of data and try to turn it into three different types of charts (e.g., Bar, Line, and Pie) to see which one tells the story best.\n*   **Days 6\u20137: Iterative Refinement**\n    *   Take a chart you\u2019ve already built and try to add a new feature or change a style without breaking what is already working.\n\n**The 30-Minute \"Micro-Sprint\" Format:**\n1.  **Setup (5 min):** Open your code editor and browser.\n2.  **Implementation (20 min):** Focus on one specific task (e.g., \"Make the Y-axis start at zero\").\n3.  **Verification (5 min):** Check your work, fix any errors, and log your progress.\n\n---\n\n### **3. Measuring Success**\nWe will track progress using both hard data and how you feel about your growth.\n\n**Objective Progress (The \"Stats\"):**\n*   **Syntactic Accuracy:** How many times do you need to refresh the page before the chart appears without an error message? (Lower is better).\n*   **Implementation Speed:** How many minutes does it take you to add a specific feature using the official documentation?\n\n**Subjective Progress (The \"Feel\"):**\n*   **Schema Fluency:** On a scale of 1\u201310, how easy is it for you to organize your data without looking at a cheat sheet?\n*   **Frustration Threshold:** Noticing if you feel discouraged when a chart fails to render, or if you feel curious and ready to fix it.\n\n---\n\n### **4. Assumptions & Prerequisites**\nTo ensure this plan works, the following is assumed to be true:\n*   **Basic Web Skills:** You are comfortable writing basic JavaScript and can find specific parts of a webpage (DOM elements) using their ID.\n*   **Ready Environment:** You have a code editor (like VS Code) and a web browser ready to go.\n*   **Documentation Literacy:** \"Proficiency\" means you know how to find answers in the official Chart.js manual, rather than having to memorize every single command."
}